[
  {
    "name": "Farroom",
    "category": "Tiny laptops and remote desktops",
    "url": "https://farroom.danielren.tz/",
    "description": "Turns the lower half into a trackpad beneath your remote desktop. Supports Mac Screen Sharing, VNC, RDP and Sunshine with a compatible host.",
    "evidence_url": "https://farroom.danielren.tz/",
    "evidence_note": "Duo section specifies iOS 27.1 and labels screenshots as simulator captures.",
    "tier": "primary",
    "availability": "available",
    "checked_at": "2026-10-26",
    "id": "farroom",
    "features": [
      "posture-layout"
    ],
    "feature_evidence": {
      "posture-layout": "https://farroom.danielren.tz/"
    }
  },
  {
    "name": "Headroom",
    "category": "Tiny laptops and remote desktops",
    "url": "https://apps.apple.com/us/app/headroom-remote-desktop/id6790331904",
    "description": "Puts your remote Mac above the fold and a keyboard or trackpad below. Uses macOS Screen Sharing; a reachable Mac is required.",
    "evidence_url": "https://apps.apple.com/us/app/headroom-remote-desktop/id6790331904",
    "evidence_note": "Duo description and 1.4.1 trackpad release note.",
    "tier": "primary",
    "availability": "available",
    "checked_at": "2026-10-26",
    "id": "headroom",
    "features": [
      "posture-layout",
      "cover-display",
      "expanded-layout"
    ],
    "feature_evidence": {
      "posture-layout": "https://apps.apple.com/us/app/headroom-remote-desktop/id6790331904",
      "cover-display": "https://apps.apple.com/us/app/headroom-remote-desktop/id6790331904",
      "expanded-layout": "https://apps.apple.com/us/app/headroom-remote-desktop/id6790331904"
    }
  },
  {
    "name": "LumenDesk",
    "category": "Tiny laptops and remote desktops",
    "url": "https://apps.apple.com/us/app/lumendesk/id6812616599",
    "description": "Moves a remote Mac workspace between the Duo's laptop layout and USB-C display glasses. Mac streaming requires its companion app and Pro access.",
    "evidence_url": "https://apps.apple.com/us/app/lumendesk/id6812616599",
    "evidence_note": "Version 1.0.1 describes laptop, flat and closed poses.",
    "tier": "primary",
    "availability": "available",
    "checked_at": "2026-10-26",
    "id": "lumendesk",
    "additional_evidence_urls": [
      "https://lumendesk.dev/"
    ],
    "features": [
      "posture-layout",
      "cover-display",
      "expanded-layout"
    ],
    "feature_evidence": {
      "posture-layout": "https://apps.apple.com/us/app/lumendesk/id6812616599",
      "cover-display": "https://apps.apple.com/us/app/lumendesk/id6812616599",
      "expanded-layout": "https://apps.apple.com/us/app/lumendesk/id6812616599"
    }
  },
  {
    "name": "Remio",
    "category": "Tiny laptops and remote desktops",
    "url": "https://github.com/remioapp/releases",
    "description": "Remote desktop with the computer above the hinge and keyboard below. Requires Remio Host; the linked GitHub repository distributes releases, not app source.",
    "evidence_url": "https://github.com/remioapp/releases",
    "evidence_note": "Official releases README has an explicit iPhone Duo feature row.",
    "tier": "primary",
    "availability": "available",
    "checked_at": "2026-10-26",
    "id": "remio",
    "features": [
      "posture-layout"
    ],
    "feature_evidence": {
      "posture-layout": "https://github.com/remioapp/releases"
    }
  },
  {
    "name": "Scry",
    "category": "Tiny laptops and remote desktops",
    "url": "https://bravely.dev/scry/iphone-duo",
    "description": "Remote access to Mac, Windows and Linux with layouts for both Duo displays and a partially folded laptop mode. Requires a host computer.",
    "evidence_url": "https://bravely.dev/iphone-duo",
    "evidence_note": "Developer's Duo app index explicitly states laptop mode.",
    "tier": "primary",
    "availability": "available",
    "checked_at": "2026-10-26",
    "id": "scry",
    "features": [
      "posture-layout",
      "cover-display"
    ],
    "feature_evidence": {
      "posture-layout": "https://bravely.dev/iphone-duo",
      "cover-display": "https://bravely.dev/iphone-duo"
    }
  },
  {
    "name": "Sill",
    "category": "Tiny laptops and remote desktops",
    "url": "https://github.com/Saffsanity/sill",
    "description": "Streams a Mac window or desktop with hinge-aware screen, trackpad and keyboard layouts. Open source; requires an Apple silicon Mac and the companion app.",
    "evidence_url": "https://github.com/Saffsanity/sill",
    "evidence_note": "README explicitly describes flat, half-open and cover-display behavior.",
    "tier": "primary",
    "availability": "available",
    "source_url": "https://github.com/Saffsanity/sill",
    "checked_at": "2026-10-26",
    "id": "sill",
    "features": [
      "posture-layout",
      "cover-display",
      "expanded-layout"
    ],
    "feature_evidence": {
      "posture-layout": "https://github.com/Saffsanity/sill",
      "cover-display": "https://github.com/Saffsanity/sill",
      "expanded-layout": "https://github.com/Saffsanity/sill"
    }
  },
  {
    "name": "Agent HUD",
    "category": "Desktop workspaces and terminals",
    "url": "https://apps.apple.com/us/app/agent-hud/id6812113619",
    "description": "Follow AI agents running on your Mac with session details beside the session list and token charts beside recent usage.",
    "evidence_url": "https://apps.apple.com/us/app/agent-hud/id6812113619",
    "evidence_note": "Version 1.6 documents Duo's landscape panes and retaining the selected session across folding. Requires the companion Mac app.",
    "tier": "primary",
    "availability": "available",
    "checked_at": "2026-10-26",
    "features": [
      "expanded-layout"
    ],
    "feature_evidence": {
      "expanded-layout": "https://apps.apple.com/us/app/agent-hud/id6812113619"
    },
    "id": "agent-hud"
  },
  {
    "name": "Hey Terminal",
    "category": "Desktop workspaces and terminals",
    "url": "https://apps.apple.com/us/app/hey-terminal-ssh-client/id6761189074",
    "description": "SSH client whose terminal resizes for the inner display, cover screen and Split View. Development tools run on your remote computer.",
    "evidence_url": "https://apps.apple.com/us/app/hey-terminal-ssh-client/id6761189074",
    "evidence_note": "Version 1.3.18 lists Duo layout and viewport updates.",
    "tier": "primary",
    "availability": "available",
    "checked_at": "2026-10-26",
    "id": "hey-terminal",
    "features": [
      "cover-display",
      "expanded-layout",
      "split-view"
    ],
    "feature_evidence": {
      "cover-display": "https://apps.apple.com/us/app/hey-terminal-ssh-client/id6761189074",
      "expanded-layout": "https://apps.apple.com/us/app/hey-terminal-ssh-client/id6761189074",
      "split-view": "https://apps.apple.com/us/app/hey-terminal-ssh-client/id6761189074"
    }
  },
  {
    "name": "La Terminal",
    "category": "Desktop workspaces and terminals",
    "url": "https://apps.apple.com/us/app/la-terminal-mosh-ssh-client/id1629902861",
    "description": "SSH and Mosh terminal with support for open, closed and partially folded Duo use. Remote sessions require a server.",
    "evidence_url": "https://apps.apple.com/us/app/la-terminal-mosh-ssh-client/id1629902861",
    "evidence_note": "Version 2.0.6 explicitly announces iPhone Duo support.",
    "tier": "primary",
    "availability": "available",
    "checked_at": "2026-10-26",
    "id": "la-terminal",
    "features": [
      "posture-layout"
    ],
    "feature_evidence": {
      "posture-layout": "https://apps.apple.com/us/app/la-terminal-mosh-ssh-client/id1629902861"
    }
  },
  {
    "name": "PXS Desktop",
    "category": "Desktop workspaces and terminals",
    "url": "https://apps.apple.com/us/app/pxs-external-screen-desktop/id6756102352",
    "description": "Windowed browser and built-in tools running on the phone, with a desktop above the fold and touchpad below. Also supports external displays.",
    "evidence_url": "https://apps.apple.com/us/app/pxs-external-screen-desktop/id6756102352",
    "evidence_note": "UNFOLD IT section explicitly describes Duo laptop posture.",
    "tier": "primary",
    "availability": "available",
    "checked_at": "2026-10-26",
    "id": "pxs-desktop",
    "features": [
      "posture-layout",
      "expanded-layout"
    ],
    "feature_evidence": {
      "posture-layout": "https://apps.apple.com/us/app/pxs-external-screen-desktop/id6756102352",
      "expanded-layout": "https://apps.apple.com/us/app/pxs-external-screen-desktop/id6756102352"
    }
  },
  {
    "name": "StealthOS",
    "category": "Desktop workspaces and terminals",
    "url": "https://apps.apple.com/us/app/stealthos-private-browser/id6756983634",
    "description": "An in-app workspace with movable windows, a browser and utilities. Its Duo layout preserves window state while folding and lets windows cross the hinge.",
    "evidence_url": "https://apps.apple.com/us/app/stealthos-private-browser/id6756983634",
    "evidence_note": "Version 1.4.0 release notes explicitly describe Duo window behavior.",
    "tier": "primary",
    "availability": "available",
    "checked_at": "2026-10-26",
    "id": "stealthos",
    "features": [
      "expanded-layout"
    ],
    "feature_evidence": {
      "expanded-layout": "https://apps.apple.com/us/app/stealthos-private-browser/id6756983634"
    }
  },
  {
    "name": "Termius",
    "category": "Desktop workspaces and terminals",
    "url": "https://apps.apple.com/us/app/termius-modern-ssh-client/id549039908",
    "description": "SSH, Mosh and SFTP client for working on remote machines. Version 8.0.6 adds Duo support; the release notes do not specify a hinge-controlled interface.",
    "evidence_url": "https://apps.apple.com/us/app/termius-modern-ssh-client/id549039908",
    "evidence_note": "Version 8.0.6 adds iPhone Duo support.",
    "tier": "primary",
    "availability": "available",